{
  "schema_version": "repropack.manifest.v1",
  "packet_id": "3f5a98a6-6f8d-47d8-bd8d-62e89d1f71a3",
  "packet_name": "ci-red",
  "created_at": "2026-03-31T15:00:00Z",
  "capture_level": "repo",
  "replay_fidelity": "approximate",
  "replay_policy": "safe",
  "command": {
    "program": "cargo",
    "args": ["test"],
    "display": "cargo test",
    "cwd": "/home/runner/work/repo/repo",
    "cwd_relative_to_repo": "."
  },
  "execution": {
    "started_at": "2026-03-31T15:00:00Z",
    "finished_at": "2026-03-31T15:00:15Z",
    "duration_ms": 15000,
    "exit_code": 101,
    "signal": null,
    "success": false,
    "spawn_error": null
  },
  "git": {
    "commit_sha": "abc123",
    "ref_name": "main",
    "base": null,
    "head": null,
    "is_dirty": false,
    "changed_paths": [],
    "untracked_paths": [],
    "bundle_path": "git/repo.bundle",
    "diff_path": null,
    "worktree_patch_path": null
  },
  "environment": {
    "platform": {
      "family": "unix",
      "os": "linux",
      "arch": "x86_64"
    },
    "allowed_vars": {
      "CI": "true"
    },
    "redacted_keys": ["GITHUB_TOKEN"],
    "tool_versions": {
      "git": "git version 2.47.0",
      "cargo": "cargo 1.82.0"
    }
  },
  "inputs": [],
  "outputs": [],
  "packet_files": [],
  "omissions": [
    {
      "kind": "redaction",
      "subject": "GITHUB_TOKEN",
      "reason": "environment deny policy"
    }
  ],
  "notes": [
    "generated by repropack v0.1.0"
  ]
}
